{
  "$schema": "https://json-schema.org/draft/2020-12/schema",
  "title": "Polaris interconnect configuration (partial user overrides allowed)",
  "type": "object",
  "additionalProperties": false,
  "properties": {
    "authority": {
      "type": "object",
      "additionalProperties": false,
      "properties": {
        "url": {
          "type": [
            "string",
            "null"
          ],
          "default": null
        },
        "publicKeyFingerprints": {
          "type": "array",
          "default": [],
          "uniqueItems": true,
          "items": {
            "type": "string",
            "pattern": "^[a-fA-F0-9]{64}$"
          }
        }
      }
    },
    "relay": {
      "type": "object",
      "additionalProperties": false,
      "properties": {
        "urls": {
          "type": "array",
          "default": [],
          "uniqueItems": true,
          "items": {
            "type": "string",
            "format": "uri",
            "pattern": "^https?://"
          }
        },
        "fallback": {
          "type": "boolean",
          "default": true
        }
      }
    },
    "security": {
      "type": "object",
      "additionalProperties": false,
      "properties": {
        "revocationPollSecs": {
          "type": "integer",
          "minimum": 1,
          "maximum": 3600,
          "default": 30
        },
        "revocationMaxAgeSecs": {
          "type": "integer",
          "minimum": 1,
          "maximum": 86400,
          "default": 600
        },
        "newDeviceWindowHours": {
          "type": "integer",
          "minimum": 1,
          "maximum": 720,
          "default": 24
        },
        "approvalTimeoutSecs": {
          "type": "integer",
          "minimum": 1,
          "maximum": 3600,
          "default": 300
        }
      }
    },
    "rateLimit": {
      "type": "object",
      "additionalProperties": false,
      "properties": {
        "windowSecs": {
          "type": "integer",
          "minimum": 1,
          "maximum": 3600
        },
        "readRequests": {
          "type": "integer",
          "minimum": 1,
          "maximum": 10000
        },
        "writeRequests": {
          "type": "integer",
          "minimum": 1,
          "maximum": 10000
        },
        "loginRequests": {
          "type": "integer",
          "minimum": 1,
          "maximum": 10000
        },
        "globalMultiplier": {
          "type": "integer",
          "minimum": 1,
          "maximum": 10000
        }
      }
    },
    "browser": {
      "type": "object",
      "additionalProperties": false,
      "properties": {
        "deviceName": {
          "type": "string",
          "minLength": 1,
          "maxLength": 40,
          "default": "Browser session"
        },
        "platform": {
          "type": "string",
          "minLength": 1,
          "maxLength": 40,
          "default": "web"
        },
        "gatewayUrl": {
          "type": [
            "string",
            "null"
          ],
          "default": null
        },
        "requestTimeoutSecs": {
          "type": "integer",
          "minimum": 1,
          "maximum": 60,
          "default": 10
        },
        "maxPeers": {
          "type": "integer",
          "minimum": 1,
          "maximum": 128,
          "default": 32
        }
      }
    },
    "ingress": {
      "type": "object",
      "additionalProperties": false,
      "properties": {
        "trustedProxyCidrs": {
          "type": "array",
          "default": [],
          "items": {
            "type": "string"
          }
        }
      }
    },
    "mailDelivery": {
      "type": "object",
      "additionalProperties": false,
      "properties": {
        "capacity": {
          "type": "integer",
          "minimum": 1,
          "maximum": 1024,
          "default": 32
        },
        "concurrency": {
          "type": "integer",
          "minimum": 1,
          "maximum": 64,
          "default": 2
        },
        "timeoutSecs": {
          "type": "integer",
          "minimum": 1,
          "maximum": 300,
          "default": 30
        }
      }
    }
  }
}
