{
  "authority": {
    "url": null,
    "publicKeyFingerprints": []
  },
  "relay": {
    "urls": [],
    "fallback": true
  },
  "security": {
    "revocationPollSecs": 30,
    "revocationMaxAgeSecs": 600,
    "newDeviceWindowHours": 24,
    "approvalTimeoutSecs": 300
  },
  "rateLimit": {
    "windowSecs": 60,
    "readRequests": 120,
    "writeRequests": 30,
    "loginRequests": 20,
    "globalMultiplier": 20
  },
  "browser": {
    "deviceName": "Browser session",
    "platform": "web",
    "gatewayUrl": null,
    "requestTimeoutSecs": 10,
    "maxPeers": 32
  }
}
